{
  "id": "draft-incident-air-canada-chatbot-refund-2024",
  "created_date": "2026-08-03",
  "source": {
    "source_type": "court_judgment",
    "title": "Moffatt v. Air Canada, 2024 BCCRT 149",
    "publisher": "Civil Resolution Tribunal of British Columbia",
    "url": "https://www.canlii.org/en/bc/bccrt/doc/2024/2024bccrt149/2024bccrt149.html",
    "published_date": "2024-02-14",
    "retrieved_date": "2026-08-03"
  },
  "raw_excerpt": "Air Canada argues it cannot be held liable for information provided by one of its agents, servants, or representatives — including a chatbot... this is a remarkable submission... Air Canada does not explain why it believes that is the case... the chatbot is still just a part of Air Canada's website. It should be obvious to Air Canada that it is responsible for all the information on its website.",
  "extraction_method": "human",
  "suggested_incident": {
    "title": "Air Canada held liable for its chatbot giving incorrect bereavement-fare information",
    "description": "A customer relied on Air Canada's website chatbot for guidance on the airline's bereavement fare policy and was given inaccurate information about retroactive refund eligibility. Air Canada argued it should not be liable for its chatbot's statements, treating it as a separate legal entity. The Civil Resolution Tribunal of British Columbia rejected that argument and held Air Canada responsible for information provided by its own chatbot, awarding the customer damages.",
    "occurred_date": "2024-02-14",
    "organizations_involved": ["Air Canada"],
    "harm_types": ["financial", "misinformation"],
    "ai_system_category": "customer_service_chatbot",
    "jurisdiction": ["CA-BC"],
    "severity": "medium",
    "root_cause": "The chatbot provided customer-facing policy information that conflicted with the airline's actual bereavement fare policy, and no process caught the discrepancy before the customer relied on it.",
    "tags": ["chatbot", "customer-service", "misinformation", "liability"]
  },
  "human_review": {
    "status": "pending"
  }
}
